{
  "formatVersion": 0,
  "domains": [
    {
      "id": "ytm",
      "name": "YouTube Music",
      "nameShort": "YT Music",
      "abbr": "YTM",
      "hostnames": [
        "music.youtube.com"
      ]
    },
    {
      "id": "yt",
      "name": "YouTube",
      "nameShort": "YT",
      "abbr": "YT",
      "hostnames": [
        "www.youtube.com",
        "youtube.com",
        "youtu.be",
        "m.youtube.com",
        "youtube-nocookie.com",
        "www.youtube-nocookie.com"
      ]
    }
  ],
  "alerts": [],
  "strings": {
    "ytm_platform_logo_svg_url": "https://music.youtube.com/img/on_platform_logo_dark.svg"
  },
  "selectors": {
    "generic": {
      "app": {
        "yt": "ytd-app",
        "ytm": "ytmusic-app"
      },
      "appHeader": {
        "ytm": "ytmusic-header-renderer"
      },
      "navBar": {
        "yt": "#masthead-container",
        "ytm": "ytmusic-nav-bar"
      },
      "player": {
        "ytm": "ytmusic-player#player"
      },
      "playerMedia": {
        "ytm": "ytmusic-player #song-media-window"
      },
      "video": {
        "yt": "ytd-player #shorts-player video, ytd-player #movie_player video",
        "ytm": "ytmusic-player video"
      },
      "pageHeaderContainer_sub_ytAppHeader": {
        "yt": "#channel-header-container, #page-header, #page-header-container"
      },
      "browseResponseHeader_sub_browseResponse": {
        "ytm": "ytmusic-browse-response #header.ytmusic-browse-response"
      },
      "playlistPopup_sub_popupContainer": {
        "yt": "tp-yt-iron-dropdown[prevent-autonav=true]"
      },
      "playlistPopupMainContainer_sub_popupContainer": {
        "yt": "yt-contextual-sheet-layout > .ytContextualSheetLayoutContentContainer"
      }
    },
    "layout": {
      "navBarLogoContent": {
        "ytm": "ytmusic-logo a"
      },
      "navBarLogoPath": {
        "ytm": "svg > g > path"
      },
      "navbarSettingsButton": {
        "ytm": "ytmusic-nav-bar ytmusic-settings-button button"
      },
      "sidebarItems_sub_sidebar": {
        "ytm": "ytmusic-guide-entry-renderer tp-yt-paper-item"
      },
      "sidebarItemRenderers_sub_sidebar": {
        "ytm": "#contentContainer #guide-content #items ytmusic-guide-entry-renderer"
      },
      "miniSidebarContainer": {
        "ytm": "#mini-guide ytmusic-guide-renderer ytmusic-guide-section-renderer #items ytmusic-guide-entry-renderer"
      },
      "listItemLeftItems_sub_listItem": {
        "ytm": ".left-items"
      },
      "listItemTitle_sub_listItem": {
        "ytm": ".title-column .title a"
      },
      "listItem_homePage": {
        "ytm": "#contents.ytmusic-section-list-renderer ytmusic-carousel-shelf-renderer ytmusic-responsive-list-item-renderer"
      },
      "listItem_watchPageRelated": {
        "ytm": "ytmusic-tab-renderer[page-type=\"MUSIC_PAGE_TYPE_TRACK_RELATED\"] ytmusic-responsive-list-item-renderer"
      },
      "listItem_playlists": {
        "ytm": "#contents.ytmusic-section-list-renderer ytmusic-playlist-shelf-renderer ytmusic-responsive-list-item-renderer"
      },
      "listItem_genericShelves": {
        "ytm": "#contents.ytmusic-section-list-renderer ytmusic-shelf-renderer ytmusic-responsive-list-item-renderer"
      },
      "genericSongListItems": {
        "ytm": "ytmusic-responsive-list-item-renderer, .card-content-container"
      },
      "genericSongListItemPlayButton_sub_listItem": {
        "ytm": "ytmusic-play-button-renderer"
      },
      "playerBarSubtitleContainer": {
        "ytm": ".content-info-wrapper .subtitle yt-formatted-string"
      },
      "playerBarSubtitleAnchors_sub_playerBarInfo": {
        "ytm": ".subtitle > yt-formatted-string a, .subtitle > yt-formatted-string span"
      },
      "popupListItemContainer_sub_popupContainer": {
        "yt": "yt-sheet-view-model .ytContextualSheetLayoutContentContainer yt-list-view-model"
      },
      "popupListItemsAll_sub_popupContainer": {
        "yt": "yt-list-view-model > toggleable-list-item-view-model"
      },
      "queueHeaderButtons_sub_sidePanel": {
        "ytm": "ytmusic-tab-renderer ytmusic-queue-header-renderer #buttons"
      },
      "queueHeaderRenderer_sub_sidePanel": {
        "ytm": "ytmusic-queue-header-renderer"
      },
      "sharePanel": {
        "yt": "yt-unified-share-panel-renderer",
        "ytm": "tp-yt-paper-dialog ytmusic-unified-share-panel-renderer"
      },
      "sharePanelInput_sub_sharePanel": "input#share-url"
    },
    "watchPage": {
      "channelName": {
        "yt": "/* regular: */ #owner ytd-channel-name yt-formatted-string a, /* collab vids: */ #owner ytd-video-owner-renderer yt-attributed-string a",
        "ytm": "ytmusic-player-bar .content-info-wrapper .subtitle a.yt-formatted-string[href]"
      },
      "votesRenderer": {
        "yt": "ytd-watch-metadata segmented-like-dislike-button-view-model",
        "ytm": ".middle-controls-buttons ytmusic-like-button-renderer"
      },
      "votesRendererShorts": {
        "yt": "reel-action-bar-view-model"
      },
      "likeBtn": {
        "yt": "#actions ytd-menu-renderer like-button-view-model button",
        "ytm": "ytmusic-like-button-renderer #button-shape-like"
      },
      "likeBtnShorts": {
        "yt": "like-button-view-model button"
      },
      "likeBtnRenderer": {
        "ytm": "ytmusic-like-button-renderer#like-button-renderer"
      },
      "likeBtnShape_sub_votesRenderer": {
        "ytm": "#button-shape-like"
      },
      "dislikeBtn": {
        "ytm": "ytmusic-like-button-renderer #button-shape-dislike"
      },
      "dislikeBtnShape_sub_votesRenderer": {
        "ytm": "#button-shape-dislike"
      },
      "dislikeBtnShorts": {
        "yt": ".ryd-synthetic-shorts-dislike button, dislike-button-view-model"
      },
      "likeBtnAlternate": {
        "yt": "like-button-view-model button",
        "ytm": "#button-shape-like button"
      },
      "dislikeBtnAlternate": {
        "yt": "dislike-button-view-model button",
        "ytm": "#button-shape-dislike button"
      },
      "progressBar": {
        "yt": ".ytp-chrome-bottom div.ytp-progress-bar[role=\"slider\"]",
        "ytm": "tp-yt-paper-slider#progress-bar tp-yt-paper-progress#sliderBar"
      },
      "videoPlayer": {
        "yt": "#movie_player"
      },
      "songImg": {
        "ytm": "ytmusic-player #song-image"
      }
    },
    "songLists": {
      "all": {
        "ytm": "ytmusic-playlist-shelf-renderer #contents, ytmusic-section-list-renderer[main-page-type=\"MUSIC_PAGE_TYPE_ALBUM\"] ytmusic-shelf-renderer #contents, ytmusic-section-list-renderer[main-page-type=\"MUSIC_PAGE_TYPE_ARTIST\"] ytmusic-shelf-renderer #contents, ytmusic-section-list-renderer[main-page-type=\"MUSIC_PAGE_TYPE_PLAYLIST\"] ytmusic-shelf-renderer #contents ytmusic-section-list-renderer[page-type=\"MUSIC_PAGE_TYPE_ALBUM\"] ytmusic-shelf-renderer #contents, ytmusic-section-list-renderer[page-type=\"MUSIC_PAGE_TYPE_ARTIST\"] ytmusic-shelf-renderer #contents, ytmusic-section-list-renderer[page-type=\"MUSIC_PAGE_TYPE_PLAYLIST\"] ytmusic-shelf-renderer #contents"
      },
      "searchPage": {
        "ytm": "ytmusic-shelf-renderer #contents, ytmusic-card-shelf-renderer .card-container"
      },
      "currentQueueContainer": {
        "ytm": "ytmusic-player-queue #contents"
      },
      "currentQueueSongAndArtistNames": {
        "ytm": "yt-formatted-string"
      },
      "autoplayQueueContainer": {
        "ytm": "ytmusic-player-queue #automix-contents"
      },
      "playlistPageArtistName": {
        "ytm": "ytmusic-detail-header-renderer .metadata .subtitle-container yt-formatted-string a"
      },
      "playlistPageArtistNameAlternate": {
        "ytm": "ytmusic-responsive-header-renderer .strapline a.yt-formatted-string[href]"
      },
      "genericListArtistName": {
        "ytm": ".secondary-flex-columns yt-formatted-string:first-child a, .secondary-flex-columns yt-formatted-string[title]"
      },
      "genericListSongName": {
        "ytm": ".title-column yt-formatted-string a"
      },
      "queueItem": {
        "ytm": "ytmusic-player-queue-item"
      },
      "queueItemThumbnailImg": {
        "ytm": "yt-img-shadow img"
      },
      "queueItemPopoverContainer": {
        "ytm": "ytmusic-app ytmusic-popup-container tp-yt-iron-dropdown"
      },
      "queueItemPopoverRemoveFromListBtn": {
        "ytm": "tp-yt-paper-listbox ytmusic-menu-service-item-renderer:nth-of-type(3)"
      },
      "queueItemPopoverRemoveFromListBtnOptional": {
        "ytm": "tp-yt-paper-listbox ytmusic-menu-service-item-renderer:nth-of-type(4)"
      },
      "queueItemDotsBtn": {
        "ytm": "ytmusic-menu-renderer yt-button-shape[id=\"button-shape\"] button"
      },
      "queueMultiSelect": {
        "ytm": "ytmusic-dialog[dialog-type=\"multiSelectMenuBar\"]"
      },
      "allCurrentQueueItems_global": {
        "ytm": "#contents.ytmusic-player-queue > ytmusic-player-queue-item"
      },
      "allCurrentQueueItemsSongInfo_global": {
        "ytm": ".song-info, .flex-columns.ytmusic-responsive-list-item-renderer"
      },
      "allGenericListItems_sub_listContainer": {
        "ytm": "ytmusic-responsive-list-item-renderer"
      }
    },
    "volume": {
      "volSlider_sub_playerBarRightControls": {
        "ytm": "tp-yt-paper-slider#volume-slider"
      },
      "volSliderExpanded_sub_playerBarRightControls": {
        "ytm": "ytmusic-player-expanding-menu tp-yt-paper-slider#expand-volume-slider"
      },
      "volSliderContainer_sub_playerBarRightControls": {
        "ytm": ".bytm-vol-slider-cont"
      },
      "volSliderExpandedContainer_sub_playerBarRightControls": {
        "ytm": "ytmusic-player-expanding-menu .bytm-vol-slider-cont"
      }
    },
    "integration": {
      "themeSongPlayerBarControls": {
        "ytm": "#ts-panel-container"
      }
    },
    "autoLike": {
      "titleContainer": {